{
  "artifact_kind": "pooleos_native_system_manifest_contract",
  "artifact_types": [
    "kernel",
    "initial_system",
    "recovery",
    "symbols",
    "microcode",
    "firmware",
    "policy",
    "pooleglyph"
  ],
  "claim_boundary": [
    "PSM1 is a candidate parser and binding contract, not an owner-ratified stable ABI.",
    "A SHA-256 match proves equality to manifest bytes only; this contract has no signature or trust anchor.",
    "The minimum secure version is parsed and compared inside one manifest but no persistent rollback state is enforced.",
    "Parser qualification does not prove live firmware file I/O; the separate PKLOAD2 receipt owns that claim.",
    "No receipt here proves retained mappings, ExitBootServices, kernel entry, target firmware, or physical media.",
    "No key is generated or used, and no signing, merge, tag, release, firmware mutation, or media write is authorized.",
    "N5 and production readiness remain false."
  ],
  "claims": {
    "canonical_manifest_grammar_defined": true,
    "deterministic_differential_fuzz_executed": true,
    "exit_boot_services_called": false,
    "golden_semantic_agreement": true,
    "hostile_controls_executed": true,
    "independent_python_parser_executed": true,
    "kernel_digest_verified": false,
    "kernel_entry_called": false,
    "kernel_pages_retained": false,
    "live_manifest_file_opened": false,
    "live_manifest_parsed_by_pooleboot": false,
    "manifest_selected_kernel_path": false,
    "manifest_signature_verified": false,
    "manifest_trusted": false,
    "measured_boot_performed": false,
    "n5_exit_gate_satisfied": false,
    "page_tables_activated": false,
    "pooleboot_compile_time_dependency": true,
    "production_ready": false,
    "rollback_enforced": false,
    "rust_no_std_parser_executed": true,
    "secure_boot_enforced": false,
    "sha256_standard_vectors_matched": true,
    "target_firmware_tested": false
  },
  "contract_id": "PSM1",
  "digest_provider_contract": "PBDIGEST1",
  "encoding": {
    "blank_lines_allowed": false,
    "bom_allowed": false,
    "character_set": "ASCII bytes 0x21..0x7E plus LF line terminators",
    "comments_allowed": false,
    "final_lf_required": true,
    "line_ending": "LF",
    "whitespace_allowed": false
  },
  "grammar": {
    "artifact_field_order": [
      "type",
      "format",
      "version",
      "path",
      "file_bytes",
      "image_bytes",
      "sha256",
      "entry_contract"
    ],
    "artifact_key_template": "artifact.<id>.<field>",
    "artifact_order": "strict ascending ASCII identifier order",
    "duplicate_policy": "reject repeated full keys and repeated artifact paths",
    "fixed_keys": [
      "manifest_id",
      "slot",
      "manifest_version",
      "minimum_secure_version",
      "artifact_count"
    ],
    "magic": "POOLEOS-SYSTEM-MANIFEST/1.0",
    "number_policy": "canonical unsigned decimal u64; no sign or leading zero except zero",
    "terminal": "end=PSM1",
    "unknown_key_policy": "reject"
  },
  "kernel_binding": {
    "entry_contract": "PKENTRY1",
    "exact_kernel_artifact_count": 1,
    "file_size_exact": true,
    "format": "PKELF1",
    "image_bytes_nonzero": true,
    "sha256_exact": true
  },
  "limits": {
    "artifacts": 16,
    "entry_contract_bytes": 16,
    "file_bytes": 67108864,
    "format_bytes": 16,
    "identifier_bytes": 31,
    "image_bytes": 536870912,
    "line_bytes": 384,
    "lines": 192,
    "manifest_bytes": 65536,
    "manifest_id_bytes": 63,
    "path_bytes": 240,
    "slot": 4
  },
  "path_policy": {
    "case": "uppercase ASCII path components",
    "component_bytes": 64,
    "dot_components_allowed": false,
    "final_component_requires_one_extension_dot": true,
    "forward_slash_allowed": false,
    "root": "\\EFI\\POOLEOS\\"
  },
  "phase_mapping": [
    "N5.1",
    "N5.4",
    "N5.5"
  ],
  "production_ready": false,
  "required_differential_cases": 16384,
  "required_golden_vector_count": 3,
  "required_negative_controls": [
    "NEG-N5-PSM1-EMPTY",
    "NEG-N5-PSM1-OVERSIZED",
    "NEG-N5-PSM1-FINAL-LF",
    "NEG-N5-PSM1-NUL",
    "NEG-N5-PSM1-BOM",
    "NEG-N5-PSM1-CRLF",
    "NEG-N5-PSM1-NON-ASCII",
    "NEG-N5-PSM1-WHITESPACE",
    "NEG-N5-PSM1-EMPTY-LINE",
    "NEG-N5-PSM1-LINE-OVERSIZED",
    "NEG-N5-PSM1-LINE-COUNT",
    "NEG-N5-PSM1-MAGIC",
    "NEG-N5-PSM1-MAJOR-VERSION",
    "NEG-N5-PSM1-MINOR-VERSION",
    "NEG-N5-PSM1-NO-EQUALS",
    "NEG-N5-PSM1-EMPTY-KEY",
    "NEG-N5-PSM1-EMPTY-VALUE",
    "NEG-N5-PSM1-MULTIPLE-EQUALS",
    "NEG-N5-PSM1-DUPLICATE-STATIC",
    "NEG-N5-PSM1-DUPLICATE-ARTIFACT",
    "NEG-N5-PSM1-UNKNOWN-STATIC",
    "NEG-N5-PSM1-UNKNOWN-ARTIFACT",
    "NEG-N5-PSM1-HEADER-ORDER",
    "NEG-N5-PSM1-ARTIFACT-FIELD-ORDER",
    "NEG-N5-PSM1-TRUNCATED-HEADER",
    "NEG-N5-PSM1-TRUNCATED-ARTIFACT",
    "NEG-N5-PSM1-END-MISSING",
    "NEG-N5-PSM1-END-WRONG",
    "NEG-N5-PSM1-MANIFEST-ID",
    "NEG-N5-PSM1-SLOT-ZERO",
    "NEG-N5-PSM1-SLOT-HIGH",
    "NEG-N5-PSM1-SLOT-LEADING-ZERO",
    "NEG-N5-PSM1-MANIFEST-VERSION-ZERO",
    "NEG-N5-PSM1-VERSION-FLOOR",
    "NEG-N5-PSM1-COUNT-ZERO",
    "NEG-N5-PSM1-COUNT-HIGH",
    "NEG-N5-PSM1-COUNT-SHORT",
    "NEG-N5-PSM1-COUNT-EXTRA",
    "NEG-N5-PSM1-ARTIFACT-ID-START",
    "NEG-N5-PSM1-ARTIFACT-ID-LENGTH",
    "NEG-N5-PSM1-ARTIFACT-ORDER",
    "NEG-N5-PSM1-ARTIFACT-TYPE",
    "NEG-N5-PSM1-FORMAT",
    "NEG-N5-PSM1-ARTIFACT-VERSION-FLOOR",
    "NEG-N5-PSM1-PATH-RELATIVE",
    "NEG-N5-PSM1-PATH-ROOT",
    "NEG-N5-PSM1-PATH-SLASH",
    "NEG-N5-PSM1-PATH-TRAVERSAL",
    "NEG-N5-PSM1-PATH-EMPTY-SEGMENT",
    "NEG-N5-PSM1-PATH-LOWERCASE",
    "NEG-N5-PSM1-PATH-LENGTH",
    "NEG-N5-PSM1-FILE-ZERO",
    "NEG-N5-PSM1-FILE-HIGH",
    "NEG-N5-PSM1-IMAGE-HIGH",
    "NEG-N5-PSM1-DIGEST-LENGTH",
    "NEG-N5-PSM1-DIGEST-LOWERCASE",
    "NEG-N5-PSM1-ENTRY-CONTRACT",
    "NEG-N5-PSM1-KERNEL-FORMAT",
    "NEG-N5-PSM1-KERNEL-ENTRY",
    "NEG-N5-PSM1-KERNEL-IMAGE-ZERO",
    "NEG-N5-PSM1-KERNEL-MISSING",
    "NEG-N5-PSM1-KERNEL-DUPLICATE",
    "NEG-N5-PSM1-DUPLICATE-PATH",
    "NEG-N5-PSM1-OUTPUT-CAPACITY"
  ],
  "schema_version": "1.0",
  "selected_move_id": "N5-MANIFEST-001",
  "status": "candidate_pre_abi_pre_signature_non_promoting",
  "version_policy": {
    "artifact_version_minimum": 1,
    "manifest_and_artifact_versions_must_meet_floor": true,
    "manifest_version_minimum": 1,
    "minimum_secure_version_may_be_zero": true,
    "persistent_rollback_state_enforced": false
  }
}
